{
  "schema_version": "option_pool.v0",
  "case_id": "D-B01",
  "session_id": "D-B01-S02",
  "generated_at": "2026-03-29T22:31:51Z",
  "source": "lm_runtime",
  "turns": [
    {
      "turn_index": 1,
      "option_readiness": "blocked",
      "safety_veto_applied": true,
      "safety_veto_reason": null,
      "brainstormer_candidates": [],
      "domain_expert_candidates": [],
      "combined_pool_count": 0,
      "domain_qualified": [],
      "domain_blocked": [],
      "presented_to_parties": null
    },
    {
      "turn_index": 3,
      "option_readiness": "blocked",
      "safety_veto_applied": true,
      "safety_veto_reason": "CATEGORY 1 structural veto: Only Party A has been heard. Party B has not yet spoken. Their interests, constraints, and response to Party A's framing ('already causing confusion,' need for 'written defaults') are completely unknown. Proceeding to option qualification before hearing Party B would be premature and would risk encoding Party A's framing as the only valid perspective. Party B must be invited to speak before option work can begin.",
      "brainstormer_candidates": [
        {
          "candidate_id": "opt-gen-001",
          "label": "Written default schedule with modification protocol",
          "rationale": "Directly addresses Party A's stated desire for written documentation and predictability while creating a framework both parties can reference. The modification protocol acknowledges that rigid schedules may not work perfectly in practice, giving both parties a pathway to adjust without returning to informal chaos.",
          "party_interest_alignment": {
            "party_a": "Provides the written defaults and predictability explicitly requested; reduces vulnerability to last-minute changes by establishing clear baseline expectations",
            "party_b": "Unknown until Party B speaks, but if Party B values flexibility, the modification protocol preserves some adaptability while still meeting Party A's documentation need"
          },
          "related_issues": [],
          "source": "option_generator"
        },
        {
          "candidate_id": "opt-gen-002",
          "label": "Phased implementation: pilot schedule with review checkpoint",
          "rationale": "If trust is fragile (suggested by Party A's emphasis on written protection), a phased approach allows both parties to test a structure without permanent commitment. The review checkpoint creates a built-in opportunity to adjust based on real experience rather than speculation.",
          "party_interest_alignment": {
            "party_a": "Provides immediate structure and predictability while acknowledging that the first iteration might need refinement; reduces risk of being locked into something unworkable",
            "party_b": "If Party B is concerned about rigidity or hasn't yet bought into Party A's framing, a pilot period may feel less threatening than a permanent arrangement"
          },
          "related_issues": [],
          "source": "option_generator"
        },
        {
          "candidate_id": "opt-gen-003",
          "label": "Communication protocol for schedule changes",
          "rationale": "Addresses the underlying concern about last-minute changes and misunderstandings without requiring immediate agreement on the substantive schedule itself. Establishes how parties will communicate (notice period, method, response expectations) which can reduce friction regardless of what the schedule contains.",
          "party_interest_alignment": {
            "party_a": "Protects against the confusion and vulnerability Party A has already experienced; creates clear boundaries around how changes are handled",
            "party_b": "If Party B values flexibility or has legitimate reasons for schedule variations, this preserves flexibility while reducing the conflict that arises from poor communication"
          },
          "related_issues": [],
          "source": "option_generator"
        },
        {
          "candidate_id": "opt-gen-004",
          "label": "Role-clarification: who manages logistics vs. who has decision authority",
          "rationale": "The 'confusion' Party A describes might stem from ambiguity about responsibilities rather than just timing. Separating logistics management (who coordinates pickups, who confirms times) from decision authority (who can change the schedule) could clarify the process even before the substantive schedule is set.",
          "party_interest_alignment": {
            "party_a": "Reduces friction by clarifying who is responsible for what, eliminating the 'I thought you were handling that' dynamic",
            "party_b": "If Party B feels blamed for the current confusion, role clarification allows both parties to take clear ownership without defensiveness"
          },
          "related_issues": [],
          "source": "option_generator"
        },
        {
          "candidate_id": "opt-gen-005",
          "label": "Child-centered transition ritual or routine",
          "rationale": "Reframes the pickup schedule issue from a parent-logistics problem to a child-experience problem. If both parties can agree on what makes transitions easier for the child, that shared goal may reduce tension around the schedule itself. Could include consistency cues the child can rely on regardless of which parent is picking up.",
          "party_interest_alignment": {
            "party_a": "Addresses the concern about confusion by creating predictability for the child, which indirectly creates structure for parents",
            "party_b": "Unknown, but most parents respond positively to child-centered framing; could shift the conversation from 'your demand for structure' to 'our shared responsibility to the child'"
          },
          "related_issues": [],
          "source": "option_generator"
        },
        {
          "candidate_id": "opt-gen-006",
          "label": "Standing schedule with opt-out exceptions list",
          "rationale": "Inverts the flexibility question: instead of asking 'when can we deviate from the default,' this establishes the default as binding unless specific pre-agreed exceptions apply (holidays, child illness, work emergencies). Balances Party A's need for predictability with practical reality that some variations are inevitable.",
          "party_interest_alignment": {
            "party_a": "Written default becomes the rule rather than a suggestion; reduces last-minute negotiation because exceptions are pre-defined",
            "party_b": "If Party B has predictable scheduling constraints (work shifts, travel), naming those upfront may feel more dignified than asking for permission each time"
          },
          "related_issues": [],
          "source": "option_generator"
        },
        {
          "candidate_id": "opt-gen-007",
          "label": "Information-sharing agreement: logistics transparency without control transfer",
          "rationale": "If Party A's concern includes feeling blindsided by changes, an agreement that requires advance sharing of relevant information (work schedules, upcoming commitments) could reduce surprises without giving either party veto power over the other's life. Creates predictability through visibility rather than restriction.",
          "party_interest_alignment": {
            "party_a": "Reduces vulnerability to last-minute surprises; allows Party A to plan around foreseeable changes",
            "party_b": "Preserves Party B's autonomy while meeting Party A's need for predictability; avoids feeling micromanaged"
          },
          "related_issues": [],
          "source": "option_generator"
        },
        {
          "candidate_id": "opt-gen-008",
          "label": "Dispute-resolution mechanism for schedule conflicts",
          "rationale": "If written defaults are agreed upon but conflicts still arise about interpretation or special circumstances, a pre-agreed method for resolving disputes (coin flip, designated tiebreaker, return to mediation) could prevent small disagreements from escalating. Acknowledges that even clear rules produce edge cases.",
          "party_interest_alignment": {
            "party_a": "Protects the written agreement from being undermined by ambiguity; ensures there's a process when the document doesn't resolve the question",
            "party_b": "If Party B is concerned about rigidity, knowing there's a fair process for exceptions may make a structured schedule feel less like a trap"
          },
          "related_issues": [],
          "source": "option_generator"
        }
      ],
      "domain_expert_candidates": [],
      "combined_pool_count": 8,
      "domain_qualified": [],
      "domain_blocked": [
        {
          "candidate_id": "opt-gen-001",
          "label": "Written default schedule with modification protocol",
          "blocking_rationale": "Party B has not yet been heard. Cannot assess whether Party B agrees that written defaults are needed, or whether they would view this as overly rigid. Party B may prioritize flexibility over documentation. Structural fit cannot be determined until Party B's interests are known.",
          "what_would_unblock": "Hear Party B's perspective on the scheduling issue and their priorities (predictability vs. flexibility, documentation vs. informal arrangement, etc.)",
          "source": "domain_reasoner"
        },
        {
          "candidate_id": "opt-gen-002",
          "label": "Phased implementation: pilot schedule with review checkpoint",
          "blocking_rationale": "Party B has not yet been heard. Cannot assess whether Party B would view a phased approach as appropriate or whether they have concerns about the fundamental structure that would make even a pilot unworkable. Trust dynamics between parties are unknown.",